{
  "$schema": "../../../schemas/talk.schema.json",
  "id": "wolf-deleted-oma-2026-07",
  "title": "HILFE! Der Wolf hat Großmutter deleted",
  "description": "In der echten Welt werden Dinge nicht einfach geupdatet oder gelöscht. Wenn der Wolf im Märchen zuschlägt, ist das ein handfestes Ereignis – und kein schnödes DELETE FROM Großmutter WHERE id = 1. Inspiriert von Golo Roden.",
  "year": 2026,
  "month": 7,
  "tags": [
    "event-sourcing",
    "architektur",
    "datenbanken"
  ],
  "slides": [
    {
      "id": "s01",
      "layout": "title",
      "title": "HILFE!\nDer Wolf hat Großmutter deleted",
      "subtitle": "Eine Geschichte über CRUD, Verlust und Event Sourcing",
      "author": "Nerzal · Juli 2026"
    },
    {
      "id": "s03",
      "layout": "table",
      "title": "CREATE",
      "statement": "INSERT INTO personen VALUES (1, 'Großmutter', 'gesund', 'Heimatdorf')",
      "columns": [
        "id",
        "name",
        "status",
        "ort"
      ],
      "rows": [
        {
          "cells": [
            "1",
            "Großmutter",
            "gesund",
            "Heimatdorf"
          ],
          "variant": "highlight"
        }
      ],
      "caption": "Omas Eltern createn. Eine neue Zeile. Ein neues Leben.",
      "ascii": "\n  ♥ ♥  ♥ ♥\n\n(˶ᵔᵕᵔ˶)(˶ᵔᵕᵔ˶)\n Mama    Papa\n\n   ↓  ↓\n\n * PLOPP! *\n\n ╔═════════╗\n ║  Hallo! ║\n ╚═════════╝\n    id = 1\n"
    },
    {
      "id": "s04",
      "layout": "table",
      "title": "UPDATE",
      "statement": "UPDATE personen SET ort = 'Waldhütte' WHERE id = 1",
      "columns": [
        "id",
        "name",
        "status",
        "ort"
      ],
      "rows": [
        {
          "cells": [
            "1",
            "Großmutter",
            "gesund",
            "Waldhütte"
          ],
          "variant": "warning"
        }
      ],
      "caption": "Location 'Heimatdorf' ist updated. Für immer. Wir sehen nur noch das Jetzt.",
      "ascii": "\n  👵 packt...\n\n [Heimatdorf]\n  ╳ GONE ╳\n\n      ↓\n\n [Waldhütte] 🏠\n\n*update*\n"
    },
    {
      "id": "s05",
      "layout": "table",
      "title": "READ",
      "statement": "SELECT * FROM personen WHERE id = 1",
      "columns": [
        "id",
        "name",
        "status",
        "ort"
      ],
      "rows": [
        {
          "cells": [
            "1",
            "Großmutter",
            "gesund",
            "Waldhütte"
          ],
          "variant": "normal"
        }
      ],
      "caption": "Rotkäppchen schaut nach. Oma ist da. Alles gut.",
      "ascii": "\n     👧\n \"Kurz nachsehen!\"\n\n  SELECT *\n   ──────\n  → Oma da!  ✓\n  → gesund   ✓\n  → Waldhütte✓\n\n  (ᵕ◡ᵕ) ✨\n"
    },
    {
      "id": "s06",
      "layout": "table",
      "title": "UPDATE",
      "statement": "UPDATE personen SET ort = 'Waldhütte' WHERE id = 2",
      "columns": [
        "id",
        "name",
        "status",
        "ort"
      ],
      "rows": [
        {
          "cells": [
            "1",
            "Großmutter",
            "gesund",
            "Waldhütte"
          ],
          "variant": "normal"
        },
        {
          "cells": [
            "2",
            "Wolf",
            "hungrig",
            "Waldhütte"
          ],
          "variant": "danger"
        }
      ],
      "caption": "Wolf updated seinen Standort. Zwei Einträge, ein Ort.",
      "ascii": "\n  😏 🐺\n\n\"Waldhütte...\n interessant.\"\n\n 📍 Wald\n    │\n  schleich...\n    │\n    ↓\n 📍 Waldhütte\n\n  👵 😰\n"
    },
    {
      "id": "s07",
      "layout": "table",
      "title": "DELETE",
      "statement": "DELETE FROM personen WHERE id = 1",
      "columns": [
        "id",
        "name",
        "status",
        "ort"
      ],
      "rows": [
        {
          "cells": [
            "1",
            "Großmutter",
            "gesund",
            "Waldhütte"
          ],
          "variant": "deleted"
        },
        {
          "cells": [
            "2",
            "Wolf",
            "hungrig",
            "Waldhütte"
          ],
          "variant": "danger"
        }
      ],
      "caption": "Wolf deleted Großmutter. Eine Zeile. Weg.",
      "ascii": "\n 👵: \"Wer bist—\"\n\n 🐺: *SCHLUCK*\n\n  gulp gulp\n   gulp\n\n (⌐■_■)ᕗ\n \"Mahlzeit!\"\n\n 💨 Oma: gone\n"
    },
    {
      "id": "s09",
      "layout": "table",
      "title": "CREATE",
      "statement": "INSERT INTO personen VALUES (1, 'Großmutter', 'verkleidet als Oma', 'Bett')",
      "columns": [
        "id",
        "name",
        "status",
        "ort"
      ],
      "rows": [
        {
          "cells": [
            "1",
            "Großmutter",
            "verkleidet als Oma",
            "Bett"
          ],
          "variant": "danger"
        },
        {
          "cells": [
            "2",
            "Wolf",
            "satt",
            "Waldhütte"
          ],
          "variant": "normal"
        }
      ],
      "caption": "Wolf created eine neue Großmutter. id = 1 ist wieder besetzt.",
      "ascii": "\n 🐺 + 👗 =\n\n  * P O O F *\n   ~~~✨~~~\n\n  /\\_/\\\n ( ò.ó )\n \"Ich bin\n  Großmutter!\"\n\n  (lol)\n"
    },
    {
      "id": "s10",
      "layout": "table",
      "title": "READ",
      "statement": "SELECT * FROM personen WHERE id = 1",
      "columns": [
        "id",
        "name",
        "status",
        "ort"
      ],
      "rows": [
        {
          "cells": [
            "1",
            "Großmutter",
            "verkleidet als Oma",
            "Bett"
          ],
          "variant": "warning"
        }
      ],
      "caption": "Oh Großmutter was hast du für große Augen?",
      "ascii": "\n    👧:\n \"Was hast große\n  du für Große Augen?!\"\n\n    👵❓:\n \"Damit ich\n  dich besser\n  sehen kann!\"\n\n  ⚠ hihi ⚠\n"
    },
    {
      "id": "s11",
      "layout": "table",
      "title": "DELETE",
      "statement": "DELETE FROM personen WHERE id = 1",
      "columns": [
        "id",
        "name",
        "status",
        "ort"
      ],
      "rows": [
        {
          "cells": [
            "1",
            "Großmutter",
            "verkleidet als Oma",
            "Bett"
          ],
          "variant": "deleted"
        }
      ],
      "caption": "Jäger deleted den Wolf. id = 1 ist wieder leer.",
      "ascii": "\n 🪓 Jäger:\n\"HEUTE NICHT!\"\n\n *WUUUSH!* 💨\n *C-H-O-P!* 🪓\n *C-H-O-P!* 🪓\n *C-H-O-P!* 🪓\n *THUD!*    💥\n\n 🐺: [deleted]\n\n  🎉 🎉 🎉\n"
    },
    {
      "id": "s12",
      "layout": "table",
      "title": "CREATE",
      "statement": "INSERT INTO personen VALUES (1, 'Großmutter', ???, ???)",
      "columns": [
        "id",
        "name",
        "status",
        "ort"
      ],
      "rows": [
        {
          "cells": [
            "1",
            "Großmutter",
            "???",
            "???"
          ],
          "variant": "warning"
        }
      ],
      "caption": "Jäger versucht Oma wiederherzustellen. Aber wie war sie nochmal?",
      "ascii": "\n    🤔\n\n \"Wie war Oma\n  nochmal...?\"\n\n name:   ✓ Oma\n status: ???\n ort:    ???\n\n \"Ich weiß\n  es nicht.\"\n\n   (¬_¬ \")\n"
    },
    {
      "id": "s13",
      "layout": "content",
      "title": "Fragen, die CRUD nicht beantworten kann",
      "bullets": [
        "Wann genau wurde Großmutter gelöscht?",
        "Wer hat den DELETE ausgeführt – und warum?",
        "Was war ihr Status, bevor der Wolf kam?",
        "Ist diese wiederhergestellte Oma wirklich die echte?",
        "Wie können wir das jemals beweisen?"
      ]
    },
    {
      "id": "s14",
      "layout": "content",
      "title": "Das Grundproblem: CRUD lebt im Jetzt",
      "bullets": [
        "Jeder UPDATE überschreibt – die Vergangenheit ist verloren",
        "Jeder DELETE löscht – nicht nur Daten, sondern Geschichte",
        "Es gibt kein natürliches Audit-Log",
        "Restore bedeutet: Raten",
        "\"Was war\" ist eine Frage, die CRUD prinzipiell nicht beantworten kann"
      ]
    },
    {
      "id": "s15",
      "layout": "content",
      "title": "Die andere Welt: Ereignisse statt Zustände",
      "bullets": [
        "Wir speichern nicht WAS ist – sondern WAS PASSIERT IST",
        "Ereignisse sind unveränderlich: kein UPDATE, kein DELETE",
        "Die Tabelle wächst nur – niemals schrumpft sie",
        "Zustand = Replay aller Ereignisse bis zu einem Zeitpunkt"
      ]
    },
    {
      "id": "s16",
      "layout": "table",
      "title": "Event #1 – Großmutter existiert",
      "statement": "INSERT INTO ereignisse VALUES (1, 'OmaAngelegt', '{status: gesund, ort: Waldhütte}')",
      "columns": [
        "#",
        "ereignis",
        "details"
      ],
      "rows": [
        {
          "cells": [
            "1",
            "OmaAngelegt",
            "{ status: 'gesund', ort: 'Waldhütte' }"
          ],
          "variant": "highlight"
        }
      ],
      "caption": "Kein Zustand. Ein Fakt. Für immer gespeichert."
    },
    {
      "id": "s17",
      "layout": "table",
      "title": "Event #2 – Der Wolf trifft auf Oma",
      "statement": "INSERT INTO ereignisse VALUES (2, 'WolfTrittEin', '{täter: Wolf, ort: Waldhütte}')",
      "columns": [
        "#",
        "ereignis",
        "details"
      ],
      "rows": [
        {
          "cells": [
            "1",
            "OmaAngelegt",
            "{ status: 'gesund', ort: 'Waldhütte' }"
          ],
          "variant": "normal"
        },
        {
          "cells": [
            "2",
            "WolfTrittEin",
            "{ täter: 'Wolf', ort: 'Waldhütte' }"
          ],
          "variant": "highlight"
        }
      ],
      "caption": "Der Wolf taucht auf – als Ereignis, nicht als UPDATE."
    },
    {
      "id": "s18",
      "layout": "table",
      "title": "Event #3 – Der Wolf frisst Oma",
      "statement": "INSERT INTO ereignisse VALUES (3, 'WolfFrisstOma', '{täter: Wolf}')",
      "columns": [
        "#",
        "ereignis",
        "details"
      ],
      "rows": [
        {